{
  "all_spatial": true,
  "axis_names": [
    "x",
    "y",
    "z",
    "w"
  ],
  "axis_shuffle_permutation": [
    40,
    22,
    7,
    44,
    13,
    9,
    29,
    30,
    39,
    33,
    3,
    47,
    15,
    27,
    31,
    32,
    11,
    24,
    36,
    8,
    14,
    46,
    10,
    0,
    21,
    45,
    18,
    26,
    25,
    34,
    20,
    16,
    42,
    28,
    17,
    43,
    12,
    1,
    37,
    19,
    41,
    35,
    5,
    6,
    38,
    23,
    2,
    4
  ],
  "axis_shuffle_placebo_seed": 20391353,
  "basis": [
    [
      -0.004067448951,
      0.0,
      0.71806621464,
      -0.69591501029,
      -0.0,
      -0.0,
      -0.0,
      -0.0,
      -0.0,
      -0.0,
      -0.0,
      -0.0,
      -0.0,
      -0.0,
      -0.0,
      -0.0,
      -0.0,
      -0.0,
      -0.0,
      -0.0,
      -0.0,
      -0.0,
      -0.0,
      -0.0,
      -0.00187046528,
      -0.001738932283,
      0.001828677197,
      0.000359366029,
      0.001442244332,
      -0.00166991758,
      -0.001316617607,
      -0.000604318428,
      -0.001099398461,
      0.001284364347,
      0.002215940564,
      0.001942111645,
      -0.001682014232,
      0.001848131014,
      0.002122986706,
      0.00160830122,
      -0.001964536598,
      -0.000360197861,
      -0.001577071432,
      0.002513607489,
      -0.001766381593,
      0.001820970377,
      -0.001252437745,
      0.002006119034
    ],
    [
      -0.000481746116,
      0.0,
      0.695935375532,
      0.718087320414,
      -0.0,
      -0.0,
      -0.0,
      -0.0,
      -0.0,
      -0.0,
      -0.0,
      -0.0,
      -0.0,
      -0.0,
      -0.0,
      -0.0,
      -0.0,
      -0.0,
      -0.0,
      -0.0,
      -0.0,
      -0.0,
      -0.0,
      -0.0,
      5.050382e-05,
      8.878673e-06,
      -0.001016280128,
      0.000302620477,
      0.000382163441,
      0.001215128149,
      0.000451652354,
      0.000660902762,
      0.000989744126,
      -0.001229497281,
      -0.001108832511,
      -0.000407458131,
      0.000874246264,
      0.000336377288,
      2.1146274e-05,
      0.00086422773,
      0.000108049234,
      0.000647108826,
      -0.002141403067,
      0.001154342793,
      0.000513236089,
      -0.001254686505,
      -0.002498986076,
      0.000994063344
    ],
    [
      0.999923884604,
      0.0,
      0.003238754864,
      -0.00246706342,
      -0.0,
      -0.0,
      -0.0,
      -0.0,
      0.0,
      0.0,
      0.0,
      0.0,
      0.0,
      0.0,
      0.0,
      -0.0,
      -0.0,
      -0.0,
      -0.0,
      -0.0,
      -0.0,
      -0.0,
      -0.0,
      -0.0,
      0.000482760953,
      -0.000638493988,
      0.003625265214,
      0.006268361864,
      -0.002306822264,
      -0.0013897375,
      -0.002575598372,
      0.003460060466,
      -0.003655660889,
      0.000721982475,
      0.000398486507,
      0.002251249498,
      0.001083669603,
      0.001139376412,
      0.000253560395,
      0.002361780223,
      0.003756274948,
      -8.7049146e-05,
      -0.000588230416,
      -0.001333385176,
      -0.00095932917,
      0.00029358616,
      -0.000988477361,
      0.003356090897
    ],
    [
      -0.002697032217,
      -0.0,
      -5.7581763e-05,
      9.6042727e-05,
      0.0,
      -0.0,
      -0.0,
      0.0,
      0.0,
      0.0,
      0.0,
      -0.0,
      0.0,
      0.0,
      -0.0,
      0.0,
      -0.0,
      -0.0,
      0.0,
      -0.0,
      -0.0,
      -0.0,
      0.0,
      0.0,
      -0.243126600625,
      0.044565094602,
      0.060180472466,
      0.155045254354,
      0.327685582079,
      -0.307314424393,
      0.17225058077,
      0.573779571203,
      0.017236470736,
      -0.093895937724,
      0.066761996848,
      -0.213885740511,
      -0.144941762913,
      -0.05928193949,
      0.09518793404,
      0.150677985079,
      0.275264009684,
      0.154294068855,
      0.133509653741,
      0.07149361409,
      -0.080421146399,
      -0.219154653098,
      0.229926208653,
      0.07100552837
    ]
  ],
  "basis_sha256": "c9f87c3eb4692a7889acf7f756e4bab7e59a2316df52434d9befab723d04e03c",
  "cell_quantization": {
    "cell_width": 0.25,
    "method": "nearest_integer_cell"
  },
  "center": [
    1.32e-10,
    0.0,
    -8.3e-11,
    5.79e-10,
    0.0,
    0.0,
    0.029999999329,
    0.029999999329,
    0.004330127034,
    0.004330127034,
    0.008660254069,
    0.004330127034,
    0.0,
    -0.008660254069,
    -0.004330127034,
    0.0,
    -0.004330127034,
    0.0,
    0.004330127034,
    -0.004330127034,
    0.014999999665,
    0.014999999665,
    -0.014999999665,
    -0.014999999665,
    -0.000153694224,
    -0.000232094069,
    0.000276600162,
    4.2747091e-05,
    0.000209367845,
    -0.000238341458,
    -0.00033013888,
    -9.5844568e-05,
    -0.000102113361,
    0.000211424803,
    0.000241344374,
    0.000135858834,
    -0.000211686094,
    0.000166287658,
    0.000242453208,
    0.000171683287,
    -0.000153595347,
    -5.4649776e-05,
    -0.00014846774,
    0.000197492309,
    -0.000178280966,
    0.000302350208,
    -0.000172981463,
    0.00014551208
  ],
  "certificate": {
    "distance_expansion_violations": 0,
    "maximum_distance_expansion": 0.0,
    "non_expansive": true,
    "orthonormal_max_error": 1.3322676295501878e-15,
    "spectral_norm": 1.0,
    "tolerance": 1e-05
  },
  "deterministic_replay": true,
  "deterministic_replay_sha256": "36171dc15b80f4e85d564bb97611447b50267a68437302c3a9cbae1e76d61eb6",
  "explained_variance_ratio": [
    0.491566982108,
    0.491538400228,
    0.015717726344,
    6.4443685e-05
  ],
  "fit_node_count": 586,
  "fit_node_ids_sha256": "bd09177b9613ee95587b18ced22fcc4b07cb24f02af323e7c4590cf0a7eebdde",
  "fit_split": "train",
  "has_time_axis": false,
  "method": "train_split_centered_pca_with_orthonormal_rows",
  "metric": "euclidean_l2",
  "observer_only": true,
  "projection_id": "taxonomy-mesh2026-chemistry-0034-v0-all-spatial-shadow4-v1",
  "random_basis_placebo_seed": 20365719,
  "reach_radius": 1.25,
  "schema_version": 1,
  "source_coordinates_sha256": "0f83258b0bbe2ce8f3c3d05be58f0bce10b70468890cf62759e61f166f83e8c4",
  "source_dimensions": 48,
  "target_dimensions": 4,
  "train_rank": 27,
  "used_for_admission": false,
  "world_id": "taxonomy-mesh2026-chemistry-0034-v0"
}
