{
  "all_spatial": true,
  "axis_names": [
    "x",
    "y",
    "z",
    "w"
  ],
  "axis_shuffle_permutation": [
    29,
    16,
    6,
    34,
    39,
    23,
    43,
    10,
    26,
    46,
    24,
    42,
    20,
    30,
    25,
    31,
    8,
    27,
    33,
    32,
    7,
    15,
    21,
    14,
    41,
    19,
    38,
    5,
    44,
    9,
    28,
    11,
    2,
    18,
    22,
    4,
    35,
    40,
    45,
    12,
    13,
    37,
    3,
    36,
    47,
    0,
    1,
    17
  ],
  "axis_shuffle_placebo_seed": 20391357,
  "basis": [
    [
      -0.003962105939,
      -0.0,
      0.997553183757,
      0.069418364885,
      -0.0,
      -0.0,
      -0.0,
      -0.0,
      -0.0,
      -0.0,
      -0.0,
      -0.0,
      -0.0,
      -0.0,
      -0.0,
      -0.0,
      -0.0,
      -0.0,
      -0.0,
      -0.0,
      -0.0,
      -0.0,
      -0.0,
      -0.0,
      0.00262522261,
      -0.001357132513,
      -0.000935452351,
      0.00186125328,
      0.001025552383,
      -0.00105601253,
      0.001038306454,
      -0.000448327235,
      0.000567482727,
      -0.001318213004,
      0.001447471776,
      0.001747718916,
      -0.001070408201,
      -0.001886415125,
      0.001157823491,
      -0.00056498759,
      0.000736761176,
      0.001815594031,
      -0.000921754089,
      -0.00105798526,
      0.002313465455,
      0.00255206323,
      -0.00023515779,
      -0.002284041096
    ],
    [
      -0.001218549311,
      -0.0,
      -0.069443110461,
      0.997556842506,
      -0.0,
      -0.0,
      -0.0,
      -0.0,
      -0.0,
      -0.0,
      -0.0,
      -0.0,
      -0.0,
      -0.0,
      -0.0,
      -0.0,
      -0.0,
      -0.0,
      -0.0,
      -0.0,
      -0.0,
      -0.0,
      -0.0,
      -0.0,
      0.001010675128,
      0.001577493464,
      0.000796994464,
      0.001697892025,
      0.002085777696,
      -0.002188650609,
      0.002208970086,
      -0.002915679526,
      0.000743573823,
      -0.002154396862,
      0.001547532776,
      0.000193644375,
      -0.001233524629,
      0.00012366095,
      0.000698622399,
      -0.003311273841,
      -0.000550950548,
      6.8989235e-05,
      0.001363609352,
      -0.001701420957,
      0.000461329432,
      -0.000779807524,
      -0.000650567482,
      0.000207926578
    ],
    [
      0.999924555684,
      -0.0,
      0.003868010664,
      0.001486452054,
      0.0,
      0.0,
      0.0,
      0.0,
      0.0,
      0.0,
      0.0,
      0.0,
      0.0,
      0.0,
      0.0,
      0.0,
      0.0,
      0.0,
      0.0,
      0.0,
      0.0,
      0.0,
      0.0,
      0.0,
      0.002783561719,
      -0.000406807255,
      0.002380526183,
      0.00079224185,
      0.00330980512,
      -0.003186237981,
      -0.000508225998,
      0.003162214552,
      -0.001105086227,
      -0.001943441122,
      -0.003014047329,
      -0.00117950421,
      0.005265189398,
      -0.001972496176,
      0.001415299028,
      -0.000849871225,
      -5.9221985e-05,
      0.002708798455,
      0.002827986241,
      0.001331247743,
      -0.00291075874,
      -0.001758606959,
      0.002717056849,
      -0.001506047162
    ],
    [
      -9.4025262e-05,
      0.0,
      0.000569924108,
      -8.4020003e-05,
      0.0,
      -0.0,
      0.0,
      0.0,
      -0.0,
      0.0,
      0.0,
      0.0,
      -0.0,
      -0.0,
      0.0,
      -0.0,
      -0.0,
      -0.0,
      0.0,
      -0.0,
      -0.0,
      -0.0,
      -0.0,
      0.0,
      -0.233886639981,
      0.183706690192,
      -0.085341963169,
      0.054865733706,
      0.452507496536,
      -0.063687872365,
      -0.261985730561,
      -0.320019102928,
      -0.222565966936,
      0.052862977288,
      0.11304138539,
      0.162613643016,
      -0.06414326947,
      0.183570237881,
      0.162448706091,
      0.329463386214,
      0.136404989154,
      0.204846346016,
      0.014281578972,
      0.120814282503,
      -0.005742327383,
      0.025060726307,
      0.347452446514,
      0.245631335507
    ]
  ],
  "basis_sha256": "f8050b06063ae8018e70f813ed1fe22636f9365dfee6088971cc0808b59e737c",
  "cell_quantization": {
    "cell_width": 0.25,
    "method": "nearest_integer_cell"
  },
  "center": [
    2e-12,
    0.0,
    1.1e-11,
    1.62e-10,
    0.0,
    0.0,
    0.029999999329,
    0.029999999329,
    0.004330127034,
    0.004330127034,
    0.008660254069,
    0.004330127034,
    0.0,
    -0.008660254069,
    -0.004330127034,
    0.0,
    -0.004330127034,
    0.0,
    0.004330127034,
    -0.004330127034,
    0.014999999665,
    0.014999999665,
    -0.014999999665,
    -0.014999999665,
    0.000310722742,
    8.2758235e-05,
    -7.5728813e-05,
    0.000301595835,
    0.000255543254,
    -0.000252589938,
    0.000386884687,
    -0.000263335231,
    0.000147266229,
    -0.000313668353,
    0.000227330434,
    7.6866495e-05,
    -0.00015228497,
    -0.00019986953,
    0.000177331033,
    -0.000288776824,
    0.000121517911,
    4.2551512e-05,
    9.3167997e-05,
    -0.000164674617,
    0.000204568531,
    0.000147330917,
    -8.6950994e-05,
    -0.000177967658
  ],
  "certificate": {
    "distance_expansion_violations": 0,
    "maximum_distance_expansion": 0.0,
    "non_expansive": true,
    "orthonormal_max_error": 5.551115123125783e-16,
    "spectral_norm": 1.0,
    "tolerance": 1e-05
  },
  "deterministic_replay": true,
  "deterministic_replay_sha256": "942e258b432c8d27991cc27b2e6d453294f780e8a2fa733741cace6a829451d2",
  "explained_variance_ratio": [
    0.491378102826,
    0.49130306712,
    0.01615222699,
    7.5898462e-05
  ],
  "fit_node_count": 570,
  "fit_node_ids_sha256": "0960846969dc7b3f796d459b83bb45710cf46eb2421f6fa58797217daeb60eb2",
  "fit_split": "train",
  "has_time_axis": false,
  "method": "train_split_centered_pca_with_orthonormal_rows",
  "metric": "euclidean_l2",
  "observer_only": true,
  "projection_id": "taxonomy-mesh2026-chemistry-0038-v0-all-spatial-shadow4-v1",
  "random_basis_placebo_seed": 20365723,
  "reach_radius": 1.25,
  "schema_version": 1,
  "source_coordinates_sha256": "46077f8eec12c9c155fe8932ed55546eb0b23e2a490adf44a015d39e70faebeb",
  "source_dimensions": 48,
  "target_dimensions": 4,
  "train_rank": 27,
  "used_for_admission": false,
  "world_id": "taxonomy-mesh2026-chemistry-0038-v0"
}
