{
  "all_spatial": true,
  "axis_names": [
    "x",
    "y",
    "z",
    "w"
  ],
  "axis_shuffle_permutation": [
    4,
    30,
    12,
    34,
    35,
    29,
    23,
    6,
    41,
    7,
    16,
    0,
    24,
    38,
    13,
    43,
    5,
    31,
    28,
    19,
    40,
    45,
    39,
    8,
    15,
    44,
    46,
    25,
    37,
    21,
    22,
    17,
    36,
    3,
    26,
    42,
    32,
    20,
    18,
    2,
    14,
    33,
    11,
    9,
    47,
    27,
    1,
    10
  ],
  "axis_shuffle_placebo_seed": 20391419,
  "basis": [
    [
      -0.004182189689,
      -0.0,
      0.999917678309,
      -0.007212183089,
      -0.0,
      -0.0,
      -0.0,
      -0.0,
      -0.0,
      -0.0,
      -0.0,
      -0.0,
      -0.0,
      -0.0,
      -0.0,
      -0.0,
      -0.0,
      -0.0,
      -0.0,
      -0.0,
      -0.0,
      -0.0,
      -0.0,
      -0.0,
      -0.001922138452,
      -0.002410118943,
      0.002687917186,
      -0.002706054934,
      -0.002517074585,
      0.000329964959,
      -0.002163624681,
      0.000573777756,
      -0.000124415386,
      -0.002891418918,
      -0.000714483997,
      -0.002050001881,
      0.004112590421,
      0.000274120927,
      0.001585113023,
      0.001607317891,
      0.000383074057,
      -7.9125505e-05,
      0.002687551769,
      0.001673453342,
      0.001197207369,
      -0.002524998488,
      0.001591349935,
      -0.001983248705
    ],
    [
      0.001764573593,
      0.0,
      0.007221404997,
      0.999952945216,
      0.0,
      0.0,
      0.0,
      0.0,
      0.0,
      0.0,
      0.0,
      0.0,
      0.0,
      0.0,
      0.0,
      0.0,
      0.0,
      0.0,
      0.0,
      0.0,
      0.0,
      0.0,
      0.0,
      0.0,
      0.002113890902,
      -0.000486634803,
      -0.001306262358,
      -0.002676033952,
      -0.001135582926,
      0.000278993235,
      -0.001652292822,
      -0.002068389072,
      -0.000392220089,
      -0.000592872096,
      0.000444483355,
      0.001022424348,
      0.000329302177,
      0.001042395038,
      0.002015999591,
      -0.001502670595,
      -0.000258944009,
      0.001147277589,
      -0.001709602758,
      -0.001376726841,
      -0.00105099898,
      8.6870498e-05,
      -0.000562038037,
      3.7772282e-05
    ],
    [
      0.999921509929,
      -0.0,
      0.004162527845,
      -0.001781148667,
      0.0,
      0.0,
      0.0,
      0.0,
      0.0,
      0.0,
      0.0,
      0.0,
      0.0,
      0.0,
      0.0,
      0.0,
      0.0,
      0.0,
      0.0,
      0.0,
      0.0,
      0.0,
      0.0,
      0.0,
      -0.000114890071,
      0.002981980332,
      0.001813878523,
      0.001063199652,
      -0.00269415087,
      0.001636450254,
      0.00064015346,
      0.000191321608,
      0.005955052705,
      0.00133109719,
      -0.000530241414,
      -0.002312368778,
      -0.001766299287,
      -0.000752452618,
      0.002074698988,
      0.000606477797,
      -0.001231946163,
      -0.00335888071,
      0.004435460743,
      -0.004594880018,
      0.000502890823,
      -0.000316809221,
      -0.001205074001,
      -0.00248067244
    ],
    [
      -0.000903882963,
      0.0,
      0.000170629793,
      0.000204071896,
      0.0,
      0.0,
      0.0,
      0.0,
      0.0,
      0.0,
      0.0,
      -0.0,
      -0.0,
      -0.0,
      0.0,
      -0.0,
      0.0,
      0.0,
      -0.0,
      -0.0,
      0.0,
      -0.0,
      0.0,
      0.0,
      0.229717800242,
      -0.095746325088,
      -0.191247300275,
      0.1718086262,
      0.196374288562,
      0.357033603369,
      -0.073505956745,
      -0.256228569973,
      0.215066078762,
      0.140458058517,
      0.001659692171,
      -0.197366527211,
      -0.019624434691,
      0.118311997974,
      -0.123091939366,
      -0.260096322087,
      -0.274965195505,
      0.166095954667,
      0.252198277251,
      0.291766308986,
      0.355456632385,
      -0.226030133325,
      -0.03758238021,
      -0.044454327883
    ]
  ],
  "basis_sha256": "a2f143de810fcf5ef1d80c264cc73e2c1b5a0f44d45785ef359a0cd13ffc0f38",
  "cell_quantization": {
    "cell_width": 0.25,
    "method": "nearest_integer_cell"
  },
  "center": [
    -1.21e-10,
    0.0,
    -1.06e-10,
    -6.21e-10,
    0.0,
    0.0,
    0.022500000894,
    0.029999999329,
    0.002886751434,
    0.002886751434,
    0.008660255,
    0.002886751434,
    0.002886751434,
    -0.008660255,
    -0.002886751434,
    0.002886751434,
    -0.002886751434,
    -0.002886751434,
    0.002886751434,
    -0.002886751434,
    0.014999999665,
    0.014999999665,
    -0.014999999665,
    -0.014999999665,
    -0.000237443475,
    -0.00033269212,
    0.000213542284,
    -0.000283736209,
    -0.000162847035,
    -0.000105816404,
    -0.000244025594,
    0.000171424835,
    2.1039755e-05,
    -0.000208784615,
    -2.8082612e-05,
    -0.000195854289,
    0.000349608052,
    -2.2725325e-05,
    4.1224686e-05,
    9.410985e-05,
    4.6266316e-05,
    -1.5917884e-05,
    0.000203044801,
    7.7284827e-05,
    0.000179072073,
    -0.0004356932,
    7.4546814e-05,
    -0.000142053369
  ],
  "certificate": {
    "distance_expansion_violations": 0,
    "maximum_distance_expansion": 0.0,
    "non_expansive": true,
    "orthonormal_max_error": 4.440892098500626e-16,
    "spectral_norm": 1.0000000000000002,
    "tolerance": 1e-05
  },
  "deterministic_replay": true,
  "deterministic_replay_sha256": "3830453a0ab5988ffa62c3878ca60a24b4e0c39807c65ecafc2da27f6b1d29aa",
  "explained_variance_ratio": [
    0.505309387437,
    0.471946618871,
    0.021555442188,
    9.7009567e-05
  ],
  "fit_node_count": 439,
  "fit_node_ids_sha256": "05a1e5778ece79603a8fde4048e20f8a202cc0f2719538007c2a9d1206fedd4f",
  "fit_split": "train",
  "has_time_axis": false,
  "method": "train_split_centered_pca_with_orthonormal_rows",
  "metric": "euclidean_l2",
  "observer_only": true,
  "projection_id": "taxonomy-msc2020-formal-mathematics-0003-v0-all-spatial-shadow4-v1",
  "random_basis_placebo_seed": 20365785,
  "reach_radius": 1.25,
  "schema_version": 1,
  "source_coordinates_sha256": "247e5fc8db7e51c90f55758f52bda0ff459bcb9d8b53d2dfbb5bf1247eec460b",
  "source_dimensions": 48,
  "target_dimensions": 4,
  "train_rank": 27,
  "used_for_admission": false,
  "world_id": "taxonomy-msc2020-formal-mathematics-0003-v0"
}
