{
  "all_spatial": true,
  "axis_names": [
    "x",
    "y",
    "z",
    "w"
  ],
  "axis_shuffle_permutation": [
    41,
    47,
    22,
    40,
    9,
    29,
    37,
    3,
    35,
    30,
    21,
    36,
    8,
    2,
    15,
    7,
    0,
    6,
    10,
    38,
    11,
    33,
    31,
    24,
    44,
    39,
    17,
    14,
    32,
    45,
    43,
    26,
    20,
    27,
    13,
    4,
    18,
    46,
    34,
    25,
    12,
    1,
    42,
    16,
    5,
    23,
    19,
    28
  ],
  "axis_shuffle_placebo_seed": 20391275,
  "basis": [
    [
      0.43942595455,
      0.0,
      0.876307120394,
      -0.196018339639,
      0.0,
      0.0,
      0.002057052214,
      0.0,
      0.000395879946,
      -0.002748510252,
      -0.003144390453,
      -2.55e-10,
      -0.00156087035,
      0.001956750552,
      -0.002352630242,
      -0.000395879946,
      -0.000395879946,
      -0.000791759956,
      -0.000791759956,
      2.55e-10,
      0.008228210388,
      -0.013556763371,
      -0.008228210388,
      -0.013556763371,
      -0.000231880704,
      0.000607815173,
      -0.00154243195,
      -6.6621917e-05,
      0.000513641745,
      0.001343928681,
      -0.000239553261,
      0.001987160836,
      0.000325117484,
      0.001367411357,
      0.000251277804,
      0.002394058609,
      -0.001536305721,
      -0.001470674236,
      0.00041169474,
      0.001343791799,
      -0.000850618835,
      0.00108057968,
      -0.000754399043,
      0.000813392758,
      0.001615419766,
      0.000207590809,
      0.000573710636,
      -0.000202511197
    ],
    [
      -0.044467138471,
      0.0,
      0.237580036303,
      0.968781923111,
      -0.0,
      -0.0,
      0.003360401029,
      -0.0,
      0.000646709582,
      -0.006376264308,
      -0.007022974308,
      -4.17e-10,
      -0.004436135458,
      0.005082845457,
      -0.005729554622,
      -0.000646709582,
      -0.000646709582,
      -0.001293419268,
      -0.001293419268,
      4.17e-10,
      0.013441606619,
      -0.035214982513,
      -0.013441606619,
      -0.035214982513,
      0.000450533214,
      -0.00018097335,
      0.001264576432,
      0.000600288788,
      0.000486897939,
      -0.000786287793,
      -2.3077939e-05,
      -0.000439978918,
      0.000440688707,
      0.000287003417,
      0.001520443697,
      -0.000760463027,
      0.001443670947,
      0.000765543027,
      0.000159306636,
      0.000103213437,
      -0.000849837687,
      -0.000977116768,
      0.001716958077,
      0.000475368137,
      -0.000345332644,
      0.000176028874,
      -0.000173575107,
      -0.000280731615
    ],
    [
      0.897155969202,
      -0.0,
      -0.417379656338,
      0.144110473453,
      0.0,
      0.0,
      -0.000895160802,
      0.0,
      -0.000172273804,
      0.001220388063,
      0.001392661978,
      1.11e-10,
      0.000703566623,
      -0.000875840539,
      0.001048114231,
      0.000172273804,
      0.000172273804,
      0.000344547636,
      0.000344547636,
      -1.11e-10,
      -0.003580643875,
      0.006068000321,
      0.003580643875,
      0.006068000321,
      -0.000604408505,
      -0.000145723132,
      -5.4215554e-05,
      -0.002065736848,
      0.002209328233,
      -0.000625188633,
      0.000630519205,
      -6.112112e-05,
      0.00130554483,
      0.001045142771,
      0.000318291889,
      0.001418241463,
      0.001707965772,
      -0.00023818474,
      0.000179841614,
      0.00090664785,
      -0.00123991562,
      0.00067519745,
      -0.000427584065,
      0.000185944792,
      -0.000659961495,
      0.002314439619,
      0.000960580581,
      0.001834925795
    ],
    [
      0.00104463312,
      0.0,
      -0.031233293669,
      -0.035684203005,
      -0.0,
      0.0,
      0.149662101214,
      -0.0,
      0.02880248937,
      -0.104369779812,
      -0.133172287767,
      -1.8584e-08,
      -0.017962307056,
      0.04676481501,
      -0.075567285796,
      -0.02880248937,
      -0.02880248937,
      -0.057604983387,
      -0.057604983387,
      1.8584e-08,
      0.598648516362,
      -0.323996005265,
      -0.598648516362,
      -0.323996005265,
      0.000146769043,
      -0.022272790717,
      0.00056332654,
      0.003260534632,
      0.013974478723,
      -0.004888170179,
      -0.001808254853,
      -0.014700970179,
      -0.017650252479,
      0.000721007383,
      -0.002100157539,
      -0.016139262347,
      0.016878157454,
      0.006110340093,
      -0.000234463574,
      0.000268885714,
      0.000769307933,
      0.007766583526,
      0.006031673228,
      -0.007292798783,
      -0.021908521469,
      0.007858384805,
      -0.001343829273,
      -0.011494485378
    ]
  ],
  "basis_sha256": "e33a88eef9a2328c7acdb31f2a513e91148b32c0238255539a80dba729a84c88",
  "cell_quantization": {
    "cell_width": 0.25,
    "method": "nearest_integer_cell"
  },
  "center": [
    1.362e-09,
    0.0,
    -9.69e-10,
    5.19e-10,
    0.0,
    0.0,
    0.027822580429,
    0.029999999329,
    0.003911082505,
    -0.000822568912,
    0.003926602922,
    0.008660254339,
    0.002250424467,
    -0.006999596301,
    -0.005571740543,
    -0.003911082505,
    -0.003911082505,
    0.000838089126,
    0.000838089126,
    -0.008660254339,
    0.00629032244,
    0.003494623578,
    -0.00629032244,
    0.003494623578,
    -8.1416481e-05,
    0.00052599253,
    -0.000720799088,
    -0.0002708404,
    1.3369646e-05,
    0.000464121291,
    0.000544265626,
    -8.9823707e-05,
    0.000428379759,
    0.000215077117,
    4.6858843e-05,
    -4.7146532e-05,
    0.00016420534,
    -0.000774628768,
    0.000145889782,
    -0.000153214033,
    6.5447204e-05,
    -1.5806321e-05,
    -0.000453999224,
    3.2374046e-05,
    0.000355167804,
    0.000740417903,
    0.000483933413,
    0.000530306904
  ],
  "certificate": {
    "distance_expansion_violations": 0,
    "maximum_distance_expansion": 0.0,
    "non_expansive": true,
    "orthonormal_max_error": 6.661338147750939e-16,
    "spectral_norm": 0.9999999999999998,
    "tolerance": 1e-05
  },
  "deterministic_replay": true,
  "deterministic_replay_sha256": "db8f32750343060e8bc426e937916e9a947e96a70d50c0bc851277dd9da0c060",
  "explained_variance_ratio": [
    0.381739312913,
    0.337916651149,
    0.277048658382,
    0.001769863189
  ],
  "fit_node_count": 279,
  "fit_node_ids_sha256": "70c4df4be9a417fca9a1bc788d3c1f35775d4139720cfb808e6090a7c6f28ade",
  "fit_split": "train",
  "has_time_axis": false,
  "method": "train_split_centered_pca_with_orthonormal_rows",
  "metric": "euclidean_l2",
  "observer_only": true,
  "projection_id": "network-security-browser-v0-all-spatial-shadow4-v1",
  "random_basis_placebo_seed": 20365641,
  "reach_radius": 1.25,
  "schema_version": 1,
  "source_coordinates_sha256": "e8597621ab746f87d7421241223d0037d31daea008f25eec29e8fb07ea77274b",
  "source_dimensions": 48,
  "target_dimensions": 4,
  "train_rank": 29,
  "used_for_admission": false,
  "world_id": "network-security-browser-v0"
}
