{
  "all_spatial": true,
  "axis_names": [
    "x",
    "y",
    "z",
    "w"
  ],
  "axis_shuffle_permutation": [
    38,
    14,
    18,
    26,
    16,
    42,
    8,
    19,
    44,
    4,
    47,
    32,
    24,
    23,
    33,
    36,
    25,
    13,
    22,
    41,
    15,
    0,
    20,
    3,
    34,
    17,
    31,
    12,
    5,
    39,
    21,
    40,
    27,
    29,
    10,
    30,
    45,
    7,
    1,
    35,
    43,
    2,
    11,
    28,
    46,
    9,
    37,
    6
  ],
  "axis_shuffle_placebo_seed": 20391409,
  "basis": [
    [
      -0.010609374771,
      0.0,
      0.839709216791,
      0.542887152145,
      -0.0,
      -0.0,
      -0.0,
      -0.0,
      -0.0,
      -0.0,
      -0.0,
      -0.0,
      -0.0,
      -0.0,
      -0.0,
      -0.0,
      -0.0,
      -0.0,
      -0.0,
      -0.0,
      -0.0,
      -0.0,
      -0.0,
      -0.0,
      0.001346529489,
      -0.001997846361,
      0.001005137067,
      -0.001344011244,
      -0.001273369454,
      0.001158878006,
      -0.000882181775,
      -0.001459274421,
      -0.001279855303,
      0.002477713453,
      -0.001424665505,
      -0.001807021145,
      -0.001202730634,
      -0.00060666191,
      -0.000785216406,
      -0.001867790872,
      0.002331911342,
      -0.000381167567,
      -0.001319399394,
      0.00109597752,
      0.001587748745,
      -0.000943532449,
      0.001573650186,
      0.001230647627
    ],
    [
      0.001134219903,
      -0.0,
      -0.542919961217,
      0.839761987076,
      0.0,
      0.0,
      0.0,
      0.0,
      0.0,
      0.0,
      0.0,
      0.0,
      0.0,
      0.0,
      0.0,
      0.0,
      0.0,
      0.0,
      0.0,
      0.0,
      0.0,
      0.0,
      0.0,
      0.0,
      0.001220138746,
      0.001499806323,
      0.001699089664,
      -0.001034206524,
      -0.000270190571,
      0.001643422999,
      -0.001666859032,
      -0.000685420724,
      -0.001155525679,
      -0.001313801932,
      -0.001898822733,
      4.9674374e-05,
      0.000167900178,
      -0.001309216955,
      -0.000556627026,
      -0.000338667076,
      -0.001917506858,
      0.001593982339,
      -0.001646709158,
      -0.000162069462,
      0.000259190779,
      -0.001321805377,
      0.001048527539,
      0.001418535673
    ],
    [
      0.99987623798,
      0.0,
      0.00952076147,
      0.004819264658,
      0.0,
      0.0,
      0.0,
      0.0,
      0.0,
      0.0,
      0.0,
      0.0,
      0.0,
      0.0,
      0.0,
      0.0,
      0.0,
      0.0,
      0.0,
      0.0,
      0.0,
      0.0,
      0.0,
      0.0,
      -0.001905054894,
      -0.002469431615,
      0.003543940555,
      0.000852037336,
      -0.001449726513,
      0.001524348197,
      -0.00342241551,
      0.000456399166,
      0.003815804773,
      -0.000344250141,
      0.00502782557,
      0.002036330158,
      0.000481852934,
      0.000447549918,
      -0.004555053288,
      0.002253772796,
      0.002053872795,
      -0.000595465549,
      0.001829884285,
      -0.000632753242,
      -8.8715099e-05,
      0.002851477996,
      0.002478991189,
      0.001143713756
    ],
    [
      -0.003662947775,
      -0.0,
      -0.000472412569,
      0.000312372952,
      -0.0,
      -0.0,
      0.0,
      0.0,
      -0.0,
      0.0,
      -0.0,
      -0.0,
      -0.0,
      0.0,
      -0.0,
      -0.0,
      -0.0,
      -0.0,
      0.0,
      -0.0,
      -0.0,
      -0.0,
      -0.0,
      -0.0,
      -0.215602769139,
      -0.124267152495,
      0.057555186892,
      -0.248050932819,
      0.111978014051,
      -0.163032762019,
      -0.004094080734,
      -0.014157112161,
      0.293107253245,
      -0.327929014922,
      0.305545371041,
      0.318295167333,
      0.056097002724,
      -0.155913580275,
      -0.098239376624,
      -0.186044345754,
      0.228894982541,
      0.018495612182,
      -0.023467525229,
      0.346926371778,
      0.415680676587,
      -0.1461465111,
      0.067461415973,
      0.041221262245
    ]
  ],
  "basis_sha256": "d8b5348edc353363e9cb3675d21ba708a7e2f42f638e0293fa25186232a81e6e",
  "cell_quantization": {
    "cell_width": 0.25,
    "method": "nearest_integer_cell"
  },
  "center": [
    -3.5e-11,
    0.0,
    4.56e-10,
    -2.67e-10,
    0.0,
    0.0,
    0.029999999329,
    0.029999999329,
    0.0,
    0.002886751434,
    0.0,
    0.008660255,
    0.0,
    -0.005773502868,
    0.0,
    -0.002886751434,
    0.0,
    0.0,
    0.0,
    -0.005773502868,
    0.014999999665,
    0.014999999665,
    0.014999999665,
    -0.014999999665,
    0.000168696539,
    -6.6272195e-05,
    0.000248038042,
    -0.000203090662,
    -0.000169213309,
    0.000246494145,
    -0.000322171869,
    -0.000213661675,
    -0.000166864935,
    5.668558e-05,
    -0.000270701301,
    -7.3306645e-05,
    -0.000137768404,
    -0.000189779458,
    -0.000154645597,
    -8.7361833e-05,
    0.000141530033,
    2.0601929e-05,
    -0.000145335074,
    7.4189031e-05,
    0.000177496225,
    -0.000223142169,
    0.000189698138,
    0.000323970229
  ],
  "certificate": {
    "distance_expansion_violations": 0,
    "maximum_distance_expansion": 0.0,
    "non_expansive": true,
    "orthonormal_max_error": 4.440892098500626e-16,
    "spectral_norm": 0.9999999999999999,
    "tolerance": 1e-05
  },
  "deterministic_replay": true,
  "deterministic_replay_sha256": "6169faa9aa329d13f13f8b1db38acc12861b9f9bbfe841e9af8b7f19bb8f87ba",
  "explained_variance_ratio": [
    0.477401660859,
    0.477347250256,
    0.044109089034,
    7.7188299e-05
  ],
  "fit_node_count": 202,
  "fit_node_ids_sha256": "cec612e93c93ce9be8df498ad3b29d5101c4a47a1a4bf39cf78f7436d5f31ae0",
  "fit_split": "train",
  "has_time_axis": false,
  "method": "train_split_centered_pca_with_orthonormal_rows",
  "metric": "euclidean_l2",
  "observer_only": true,
  "projection_id": "taxonomy-mesh2026-research-scientific-method-0003-v0-all-spatial-shadow4-v1",
  "random_basis_placebo_seed": 20365775,
  "reach_radius": 1.25,
  "schema_version": 1,
  "source_coordinates_sha256": "5695d61edd2b9468fd1e35bd54721e5cdb027d1af9cea5590f31dea8b2693b47",
  "source_dimensions": 48,
  "target_dimensions": 4,
  "train_rank": 27,
  "used_for_admission": false,
  "world_id": "taxonomy-mesh2026-research-scientific-method-0003-v0"
}
