{
  "all_spatial": true,
  "axis_names": [
    "x",
    "y",
    "z",
    "w"
  ],
  "axis_shuffle_permutation": [
    16,
    35,
    1,
    26,
    29,
    38,
    47,
    25,
    40,
    45,
    3,
    27,
    34,
    44,
    10,
    32,
    43,
    21,
    15,
    8,
    5,
    17,
    23,
    4,
    33,
    28,
    9,
    31,
    0,
    7,
    6,
    11,
    2,
    22,
    14,
    20,
    42,
    18,
    36,
    37,
    19,
    39,
    46,
    41,
    13,
    30,
    24,
    12
  ],
  "axis_shuffle_placebo_seed": 20391421,
  "basis": [
    [
      -0.004511524144,
      0.0,
      0.987787034764,
      -0.15548897178,
      -0.0,
      -0.0,
      -0.0,
      -0.0,
      -0.0,
      -0.0,
      -0.0,
      -0.0,
      -0.0,
      -0.0,
      -0.0,
      -0.0,
      -0.0,
      -0.0,
      -0.0,
      -0.0,
      -0.0,
      -0.0,
      -0.0,
      -0.0,
      -0.00260162365,
      -0.002595087168,
      0.002148252398,
      0.002078110217,
      -0.00217665441,
      0.001333479531,
      0.002285219728,
      0.002187363652,
      -0.003425202236,
      0.001210466046,
      -0.000534825145,
      0.001047065433,
      0.001756526591,
      5.5067927e-05,
      -0.001019295039,
      -0.001481928257,
      -0.000259609059,
      0.00153960478,
      0.000606412128,
      -0.001672516011,
      0.00198624647,
      -0.00019944456,
      -0.002187283808,
      -0.002316337483
    ],
    [
      0.003868704988,
      -0.0,
      0.155506364095,
      0.987774570102,
      -0.0,
      -0.0,
      -0.0,
      -0.0,
      0.0,
      0.0,
      0.0,
      0.0,
      0.0,
      0.0,
      0.0,
      -0.0,
      -0.0,
      -0.0,
      -0.0,
      -0.0,
      -0.0,
      -0.0,
      -0.0,
      -0.0,
      -0.000270776851,
      0.001182603718,
      0.000778049592,
      0.001509395347,
      0.002146570589,
      0.003056305189,
      -0.003832784674,
      0.000941402575,
      0.000274289453,
      0.002209752322,
      0.00138756295,
      0.0023157242,
      0.001832682009,
      -0.001416446612,
      -0.004125093998,
      -0.001037794875,
      0.000438464476,
      0.003128044277,
      0.001951609134,
      9.1694512e-05,
      -0.002160412924,
      0.000192216917,
      0.003927892759,
      0.000830886484
    ],
    [
      0.999914410299,
      0.0,
      0.003865801745,
      -0.004519790908,
      0.0,
      0.0,
      0.0,
      0.0,
      0.0,
      0.0,
      0.0,
      0.0,
      0.0,
      0.0,
      0.0,
      0.0,
      0.0,
      0.0,
      0.0,
      0.0,
      0.0,
      0.0,
      0.0,
      0.0,
      0.00128428649,
      0.002742016887,
      -0.003510633124,
      0.002134035772,
      -0.002849820846,
      0.001982886332,
      -0.001638513466,
      -0.001070471225,
      -0.002727046534,
      -0.00113233336,
      -0.002883597714,
      -0.001069003861,
      -0.000811370584,
      -0.000597234663,
      0.000635081175,
      -0.000767523069,
      0.002689366006,
      -0.001583978032,
      -0.00131574141,
      -0.002312670643,
      -0.005736667755,
      0.004457490508,
      -0.001949270265,
      -0.000533536356
    ],
    [
      0.004743911161,
      -0.0,
      0.000437356005,
      -0.001217701134,
      -0.0,
      -0.0,
      -0.0,
      0.0,
      -0.0,
      -0.0,
      0.0,
      -0.0,
      0.0,
      -0.0,
      -0.0,
      -0.0,
      0.0,
      -0.0,
      -0.0,
      -0.0,
      -0.0,
      -0.0,
      -0.0,
      -0.0,
      0.158328984058,
      -0.031878665085,
      0.135924420939,
      -0.265351424072,
      0.075354710211,
      0.021948382308,
      -0.103816762681,
      0.329470738814,
      0.356340423645,
      -0.053835701749,
      0.005173477931,
      0.10228907448,
      -0.23562130973,
      0.021554041425,
      -0.226189426867,
      0.116338122076,
      -0.180090201362,
      0.453076138098,
      -0.071244083079,
      -0.045517474189,
      0.352686547905,
      0.100657621226,
      -0.181803369336,
      0.293326920909
    ]
  ],
  "basis_sha256": "d789a9f8d7d99982c6aacff191447d7c7fd0755ab9c3ad0594a7f910d04bbd13",
  "cell_quantization": {
    "cell_width": 0.25,
    "method": "nearest_integer_cell"
  },
  "center": [
    -1.21e-10,
    0.0,
    -3.82e-10,
    3.16e-10,
    0.0,
    0.0,
    0.022500000894,
    0.029999999329,
    0.002886751434,
    0.002886751434,
    0.008660255,
    0.002886751434,
    0.002886751434,
    -0.008660255,
    -0.002886751434,
    0.002886751434,
    -0.002886751434,
    -0.002886751434,
    0.002886751434,
    -0.002886751434,
    0.014999999665,
    0.014999999665,
    -0.014999999665,
    -0.014999999665,
    -0.000250346513,
    -0.000203407314,
    0.000285143882,
    0.000153437408,
    -0.000116154189,
    0.000262700793,
    0.000174224101,
    0.000183763267,
    -0.000282021831,
    0.000134200549,
    -7.1922429e-05,
    9.673305e-05,
    0.000163439058,
    -3.6731689e-05,
    -0.000237503996,
    -0.000106355995,
    -2.193683e-06,
    0.00023768121,
    0.000193910593,
    3.321871e-06,
    0.000199085261,
    -0.000119151444,
    -0.000245144456,
    -0.000179168049
  ],
  "certificate": {
    "distance_expansion_violations": 0,
    "maximum_distance_expansion": 0.0,
    "non_expansive": true,
    "orthonormal_max_error": 9.038221897552427e-16,
    "spectral_norm": 1.0000000000000002,
    "tolerance": 1e-05
  },
  "deterministic_replay": true,
  "deterministic_replay_sha256": "13ba63b688ab83ee1306249b98601d35839d54dbeeb74d11963718dfe31afdd5",
  "explained_variance_ratio": [
    0.502400261641,
    0.475045593952,
    0.021396781918,
    9.7996788e-05
  ],
  "fit_node_count": 439,
  "fit_node_ids_sha256": "f31b68d9e354b6074165c9ebdbe05f33236ad24460b971f388f01a82158ac555",
  "fit_split": "train",
  "has_time_axis": false,
  "method": "train_split_centered_pca_with_orthonormal_rows",
  "metric": "euclidean_l2",
  "observer_only": true,
  "projection_id": "taxonomy-msc2020-formal-mathematics-0005-v0-all-spatial-shadow4-v1",
  "random_basis_placebo_seed": 20365787,
  "reach_radius": 1.25,
  "schema_version": 1,
  "source_coordinates_sha256": "eb5cdcc20d9006f2454581f8c2104a0c5ed855a0664ff42b615b73aa13c065b4",
  "source_dimensions": 48,
  "target_dimensions": 4,
  "train_rank": 27,
  "used_for_admission": false,
  "world_id": "taxonomy-msc2020-formal-mathematics-0005-v0"
}
