{
  "all_spatial": true,
  "axis_names": [
    "x",
    "y",
    "z",
    "w"
  ],
  "axis_shuffle_permutation": [
    27,
    0,
    10,
    45,
    37,
    43,
    23,
    47,
    25,
    22,
    18,
    35,
    38,
    28,
    6,
    14,
    41,
    11,
    2,
    29,
    34,
    16,
    19,
    4,
    42,
    32,
    17,
    24,
    40,
    21,
    30,
    15,
    8,
    31,
    12,
    44,
    39,
    7,
    26,
    46,
    5,
    20,
    9,
    3,
    33,
    13,
    36,
    1
  ],
  "axis_shuffle_placebo_seed": 20391341,
  "basis": [
    [
      -0.004377948733,
      -0.0,
      0.437855219038,
      0.899001790274,
      -0.0,
      -0.0,
      -0.0,
      -0.0,
      -0.0,
      -0.0,
      -0.0,
      -0.0,
      -0.0,
      -0.0,
      -0.0,
      -0.0,
      -0.0,
      -0.0,
      -0.0,
      -0.0,
      -0.0,
      -0.0,
      -0.0,
      -0.0,
      0.001909196927,
      0.001117444542,
      -0.002526353714,
      -0.001755964291,
      0.001473984664,
      -0.001946738836,
      -0.000462866086,
      0.00214850793,
      -0.001995860969,
      -0.000249917668,
      -0.001277579304,
      0.001226344619,
      0.000627036507,
      -0.001080566659,
      -0.000983540074,
      0.000961499587,
      -0.001330596378,
      -0.001280052187,
      -0.00105138493,
      0.001902847253,
      -0.002524558274,
      0.001613246121,
      0.0015751316,
      0.002010604738
    ],
    [
      0.000131087469,
      0.0,
      0.899024683038,
      -0.437866348251,
      -0.0,
      -0.0,
      -0.0,
      -0.0,
      0.0,
      0.0,
      0.0,
      0.0,
      0.0,
      0.0,
      0.0,
      -0.0,
      -0.0,
      -0.0,
      -0.0,
      -0.0,
      -0.0,
      -0.0,
      -0.0,
      -0.0,
      0.001149055229,
      -0.000216124808,
      0.001159931127,
      2.8769452e-05,
      0.000619557905,
      0.000424995885,
      -0.00099100914,
      -0.000879148857,
      0.000450801754,
      -0.002182573614,
      7.450744e-06,
      0.001625341791,
      -0.001440606783,
      -0.000129378874,
      -0.000407082982,
      0.002479346932,
      -0.000211888435,
      0.000188041838,
      -0.001163505697,
      -0.000298010163,
      0.0010229343,
      -0.000590403494,
      0.001877211508,
      -0.000418426166
    ],
    [
      0.999921028337,
      0.0,
      0.001782494347,
      0.003985767323,
      0.0,
      0.0,
      0.0,
      0.0,
      0.0,
      0.0,
      0.0,
      0.0,
      0.0,
      0.0,
      0.0,
      0.0,
      0.0,
      0.0,
      0.0,
      0.0,
      0.0,
      0.0,
      0.0,
      0.0,
      0.001877025576,
      -0.000297661436,
      0.002735768709,
      -0.001648645748,
      0.001099003218,
      -0.002931200261,
      -0.000274097548,
      0.001657976215,
      0.003893927317,
      -0.001743622152,
      -0.000195084217,
      0.00236067829,
      0.003862979961,
      0.000381208223,
      0.000734400101,
      -0.001825548337,
      0.000226680529,
      0.000338615205,
      0.002181459243,
      0.004814861984,
      0.002758206698,
      0.001198031233,
      0.00564312522,
      -0.000828379677
    ],
    [
      0.001859889445,
      0.0,
      -0.001089361321,
      0.001243576689,
      -0.0,
      0.0,
      -0.0,
      -0.0,
      -0.0,
      -0.0,
      -0.0,
      0.0,
      -0.0,
      -0.0,
      -0.0,
      -0.0,
      0.0,
      0.0,
      -0.0,
      -0.0,
      -0.0,
      -0.0,
      -0.0,
      -0.0,
      -0.315950596169,
      0.311388159206,
      -0.002686518933,
      -0.102786565269,
      0.180680409583,
      0.133812103001,
      0.255927442473,
      -0.186256878202,
      0.125834469316,
      -0.205606262079,
      -0.170196987872,
      0.289322129928,
      -0.178674415589,
      -0.229707276825,
      -0.110029458127,
      0.393930053336,
      0.005763241558,
      -0.180789963577,
      0.033488649908,
      0.059802450014,
      0.142921918076,
      0.012629568774,
      -0.298765556951,
      -0.268085030596
    ]
  ],
  "basis_sha256": "73d20ef01083678766bb5b5efd82f1e234efbfb190653ed0d34d1b32aaeb8cd3",
  "cell_quantization": {
    "cell_width": 0.25,
    "method": "nearest_integer_cell"
  },
  "center": [
    -1e-10,
    0.0,
    1.66e-10,
    -1.85e-10,
    0.0,
    0.0,
    0.029999999329,
    0.029999999329,
    0.004330127034,
    0.004330127034,
    0.008660254069,
    0.004330127034,
    0.0,
    -0.008660254069,
    -0.004330127034,
    0.0,
    -0.004330127034,
    0.0,
    0.004330127034,
    -0.004330127034,
    0.014999999665,
    0.014999999665,
    -0.014999999665,
    -0.014999999665,
    0.000180003636,
    0.00021431095,
    -0.000362418743,
    -0.000297485001,
    0.000165620413,
    -0.000161955761,
    5.8542549e-05,
    0.000265443488,
    -0.000242338097,
    2.0614018e-05,
    -0.000213489473,
    0.000107522086,
    2.7077206e-05,
    -0.000253702713,
    -0.00013029694,
    2.9770788e-05,
    -0.000267186653,
    -0.000231394503,
    -0.000134411172,
    0.000154159201,
    -0.000305036991,
    0.000153708738,
    4.8879664e-05,
    0.000179578882
  ],
  "certificate": {
    "distance_expansion_violations": 0,
    "maximum_distance_expansion": 0.0,
    "non_expansive": true,
    "orthonormal_max_error": 8.881784197001252e-16,
    "spectral_norm": 1.0000000000000002,
    "tolerance": 1e-05
  },
  "deterministic_replay": true,
  "deterministic_replay_sha256": "1b61963ca2495a44f0aa7c13b360ea987331bd476e27c4d72bbb41e37e19d614",
  "explained_variance_ratio": [
    0.492410647413,
    0.49238584606,
    0.014022555631,
    7.2335868e-05
  ],
  "fit_node_count": 658,
  "fit_node_ids_sha256": "4febb18201d8feaa48a6d10103008a12079890979f4f329db81f7a4dc1b464ec",
  "fit_split": "train",
  "has_time_axis": false,
  "method": "train_split_centered_pca_with_orthonormal_rows",
  "metric": "euclidean_l2",
  "observer_only": true,
  "projection_id": "taxonomy-mesh2026-chemistry-0022-v0-all-spatial-shadow4-v1",
  "random_basis_placebo_seed": 20365707,
  "reach_radius": 1.25,
  "schema_version": 1,
  "source_coordinates_sha256": "d9e89c06ee071dfdb9a855dcbba8ef16f0172c182e98d0185e8c20c21b137e92",
  "source_dimensions": 48,
  "target_dimensions": 4,
  "train_rank": 27,
  "used_for_admission": false,
  "world_id": "taxonomy-mesh2026-chemistry-0022-v0"
}
