{
  "all_spatial": true,
  "axis_names": [
    "x",
    "y",
    "z",
    "w"
  ],
  "axis_shuffle_permutation": [
    11,
    41,
    45,
    3,
    46,
    5,
    1,
    19,
    8,
    26,
    13,
    6,
    25,
    16,
    29,
    23,
    27,
    18,
    17,
    33,
    12,
    28,
    15,
    31,
    43,
    9,
    21,
    34,
    10,
    32,
    24,
    37,
    38,
    20,
    0,
    35,
    42,
    30,
    36,
    7,
    40,
    44,
    39,
    47,
    2,
    14,
    22,
    4
  ],
  "axis_shuffle_placebo_seed": 20391440,
  "basis": [
    [
      -0.003123212759,
      0.0,
      0.967540366251,
      0.252529759766,
      -0.0,
      -0.0,
      -0.0,
      -0.0,
      -0.0,
      -0.0,
      -0.0,
      -0.0,
      -0.0,
      -0.0,
      -0.0,
      -0.0,
      -0.0,
      -0.0,
      -0.0,
      -0.0,
      -0.0,
      -0.0,
      -0.0,
      -0.0,
      -0.001093616373,
      0.002431597092,
      -0.002377932691,
      0.000195303529,
      -0.00013504793,
      0.002092737083,
      -0.00162477137,
      0.000749052109,
      -0.000522077152,
      -0.00232572495,
      -0.001039692771,
      -0.000998087086,
      -0.003796645278,
      -0.001384140124,
      -0.002732399947,
      0.002908348324,
      -0.000417105298,
      -0.001512419321,
      -0.000961648406,
      -0.001248430856,
      0.000231267693,
      0.003204679342,
      0.00276300901,
      -0.001135590034
    ],
    [
      0.002249994265,
      -0.0,
      -0.252531519956,
      0.967520426067,
      0.0,
      0.0,
      0.0,
      0.0,
      0.0,
      0.0,
      0.0,
      0.0,
      0.0,
      0.0,
      0.0,
      0.0,
      0.0,
      0.0,
      0.0,
      0.0,
      0.0,
      0.0,
      0.0,
      0.0,
      0.004368147471,
      -6.3316857e-05,
      -0.001195858088,
      -0.002303694902,
      0.000202235297,
      -0.000838078634,
      -0.001797867836,
      -0.002749937917,
      0.001554632128,
      -0.000939690384,
      0.003307296977,
      -0.001580078078,
      -0.00100780459,
      0.004639385833,
      -0.002336184418,
      -0.001496735058,
      -0.001844797552,
      -0.000386583234,
      0.002137586604,
      -0.001906790589,
      0.002138672185,
      0.004720528144,
      0.00105624963,
      0.001712134245
    ],
    [
      0.999925156371,
      0.0,
      0.0036142181,
      -0.001361084095,
      0.0,
      0.0,
      0.0,
      0.0,
      0.0,
      0.0,
      0.0,
      0.0,
      0.0,
      0.0,
      0.0,
      0.0,
      0.0,
      0.0,
      0.0,
      0.0,
      0.0,
      0.0,
      0.0,
      0.0,
      0.003494100335,
      -0.000210660855,
      0.001429420508,
      -0.000105927289,
      0.003363654875,
      0.000914689689,
      -0.000687660566,
      -0.001968716494,
      -0.002433262077,
      0.003207645744,
      -0.002480694454,
      0.002696038319,
      -0.000239452658,
      -0.000407277926,
      0.003210202889,
      -0.001180966339,
      0.006424442584,
      -0.00122182716,
      -0.001440615454,
      0.001665331694,
      -0.000398153816,
      0.001588056889,
      -0.003458048986,
      0.000387687292
    ],
    [
      -0.006065193152,
      0.0,
      0.000240169942,
      0.000503344646,
      -0.0,
      -0.0,
      0.0,
      -0.0,
      -0.0,
      0.0,
      0.0,
      0.0,
      0.0,
      0.0,
      -0.0,
      -0.0,
      -0.0,
      -0.0,
      -0.0,
      -0.0,
      -0.0,
      0.0,
      0.0,
      0.0,
      0.087267089732,
      -0.083579256101,
      0.145259825513,
      -0.031386516789,
      0.362464271319,
      -0.069635174057,
      -0.049553071234,
      0.354609036947,
      -0.010483954234,
      0.333038597639,
      -0.046648484727,
      -0.038949530632,
      0.133109219207,
      0.23795604261,
      0.08502947457,
      0.141120307448,
      0.389925971891,
      -0.039398316977,
      -0.353836527202,
      0.062425339908,
      0.016604398347,
      0.396122156397,
      -0.070450410249,
      -0.194413372689
    ]
  ],
  "basis_sha256": "524d4c298f313a5f1460ee156acb4a867fe2c4e7fa7028f8a297bf30bf13f641",
  "cell_quantization": {
    "cell_width": 0.25,
    "method": "nearest_integer_cell"
  },
  "center": [
    -1.21e-10,
    0.0,
    -1.02e-10,
    -6.07e-10,
    0.0,
    0.0,
    0.029999999329,
    0.029999999329,
    0.004330127034,
    0.0,
    0.004330127034,
    0.008660254069,
    0.0,
    -0.004330127034,
    -0.004330127034,
    -0.004330127034,
    -0.004330127034,
    0.004330127034,
    0.0,
    -0.008660254069,
    0.014999999665,
    -0.014999999665,
    0.014999999665,
    -0.014999999665,
    -8.9948181e-05,
    0.000210624931,
    -0.000255660934,
    6.3915987e-05,
    -4.1175431e-05,
    0.000309968276,
    -0.00021104752,
    0.000216556099,
    -8.7019937e-05,
    -0.000243845467,
    -0.000233803599,
    -0.000171115207,
    -0.000172014183,
    -0.00021376304,
    -0.000183627454,
    0.000200796719,
    2.5557291e-05,
    3.0762844e-05,
    -0.000276314573,
    -0.000108336059,
    -6.2712784e-05,
    0.000237101274,
    0.000152677223,
    -0.000122009723
  ],
  "certificate": {
    "distance_expansion_violations": 0,
    "maximum_distance_expansion": 0.0,
    "non_expansive": true,
    "orthonormal_max_error": 6.661338147750939e-16,
    "spectral_norm": 1.0000000000000002,
    "tolerance": 1e-05
  },
  "deterministic_replay": true,
  "deterministic_replay_sha256": "5cd33970e54b1ba2925b81d082beab3ed17156693287cee620ed6fd976a323b7",
  "explained_variance_ratio": [
    0.48959960566,
    0.488402210807,
    0.020885089323,
    8.4469257e-05
  ],
  "fit_node_count": 439,
  "fit_node_ids_sha256": "9a3bf4cc2e124fb8a0adab03a4d369809c2ed8153c3d0cdc2cb438312e25af7a",
  "fit_split": "train",
  "has_time_axis": false,
  "method": "train_split_centered_pca_with_orthonormal_rows",
  "metric": "euclidean_l2",
  "observer_only": true,
  "projection_id": "taxonomy-msc2020-physics-0003-v0-all-spatial-shadow4-v1",
  "random_basis_placebo_seed": 20365806,
  "reach_radius": 1.25,
  "schema_version": 1,
  "source_coordinates_sha256": "c166776ebfeafc917403d6ed615295df3a13c2eeb66fc598fe0b250a49acfb27",
  "source_dimensions": 48,
  "target_dimensions": 4,
  "train_rank": 27,
  "used_for_admission": false,
  "world_id": "taxonomy-msc2020-physics-0003-v0"
}
