{
  "all_spatial": true,
  "axis_names": [
    "x",
    "y",
    "z",
    "w"
  ],
  "axis_shuffle_permutation": [
    36,
    18,
    42,
    22,
    12,
    16,
    25,
    11,
    32,
    21,
    1,
    23,
    9,
    17,
    28,
    10,
    5,
    37,
    26,
    41,
    30,
    38,
    3,
    39,
    40,
    2,
    19,
    35,
    14,
    31,
    4,
    13,
    44,
    20,
    0,
    46,
    24,
    34,
    6,
    33,
    7,
    27,
    29,
    45,
    15,
    43,
    8,
    47
  ],
  "axis_shuffle_placebo_seed": 20391282,
  "basis": [
    [
      0.933588133853,
      0.0,
      0.244921713567,
      -0.261519761902,
      0.0,
      0.0,
      0.0,
      0.0,
      0.0,
      0.0,
      0.0,
      0.0,
      0.0,
      0.0,
      0.0,
      0.0,
      0.0,
      0.0,
      0.0,
      0.0,
      -0.000705327335,
      -0.000705327335,
      0.0,
      0.001663391169,
      -0.000996383144,
      0.000720766608,
      -0.000754630162,
      -0.00263489285,
      -9.0102477e-05,
      0.000726308798,
      0.000606717267,
      0.00140623927,
      0.000445217313,
      0.001346762173,
      -0.002675985336,
      -0.001651773196,
      0.000216227683,
      0.000325791369,
      0.000423712319,
      -0.000515757246,
      -0.00093433216,
      -0.000982380238,
      -0.000503922056,
      0.00085935864,
      -0.000647092341,
      -0.000688856641,
      -0.00109299514,
      -0.000937620117
    ],
    [
      -0.092808813803,
      -0.0,
      0.870050022259,
      0.483642856634,
      -0.0,
      -0.0,
      -0.0,
      -0.0,
      -0.0,
      -0.0,
      -0.0,
      -0.0,
      -0.0,
      -0.0,
      -0.0,
      -0.0,
      -0.0,
      -0.0,
      -0.0,
      -0.0,
      -0.012942870653,
      -0.012942870653,
      -0.0,
      0.010136819002,
      -0.001443833781,
      0.001302118055,
      0.000679016255,
      -0.001840676409,
      0.001074206231,
      0.000360094293,
      -0.003166054062,
      -0.000101949006,
      -0.001963152733,
      0.001498517341,
      0.001609555273,
      0.000377835516,
      0.001816563494,
      -0.000768704097,
      0.000579945798,
      0.000414429367,
      -0.001699237962,
      -0.000210848041,
      -7.8074543e-05,
      -0.001506982262,
      0.00290328046,
      0.001480916387,
      0.001515709879,
      -0.000985718841
    ],
    [
      0.346048225242,
      -0.0,
      -0.42712238144,
      0.835217481672,
      -0.0,
      -0.0,
      -0.0,
      -0.0,
      -0.0,
      -0.0,
      -0.0,
      -0.0,
      -0.0,
      -0.0,
      -0.0,
      -0.0,
      -0.0,
      -0.0,
      -0.0,
      -0.0,
      0.005443474878,
      0.005443474878,
      -0.0,
      -0.009507364426,
      -0.001177148611,
      0.00162742988,
      0.002199463085,
      -0.00065954151,
      0.002090018376,
      0.000438533356,
      -0.001067916999,
      -0.000175161782,
      0.000838485713,
      0.003242840283,
      0.002234604102,
      0.001236183481,
      0.002006993848,
      -0.001810641813,
      0.000831264975,
      0.002879657333,
      0.000265909458,
      0.003439053287,
      0.000852469693,
      -0.002123840141,
      -0.000122644307,
      -0.003397907975,
      0.000292399159,
      -0.001162776895
    ],
    [
      -0.004527661599,
      -0.0,
      0.023509593745,
      -5.8824628e-05,
      0.0,
      0.0,
      0.0,
      0.0,
      0.0,
      0.0,
      0.0,
      0.0,
      0.0,
      0.0,
      0.0,
      0.0,
      0.0,
      0.0,
      0.0,
      0.0,
      0.590992603993,
      0.590992603993,
      0.0,
      -0.541154497282,
      -0.044034030675,
      0.009570952028,
      0.015991025876,
      0.009055307896,
      0.012810560762,
      0.006169488082,
      -0.009594289748,
      0.014993561466,
      0.028444412569,
      -0.004183459636,
      -0.023877865715,
      -0.017566350336,
      0.014318157427,
      -0.000213997606,
      -0.003281777315,
      -0.03517181176,
      -0.013582238713,
      0.008205718703,
      -0.005057253747,
      0.007030666117,
      6.9756633e-05,
      -0.031476446763,
      -0.01654903551,
      0.019927191552
    ]
  ],
  "basis_sha256": "15787ee6f3346e5ca43c4f3a96a45d85eba76ee344a53684a537a0d0af16a3e2",
  "cell_quantization": {
    "cell_width": 0.25,
    "method": "nearest_integer_cell"
  },
  "center": [
    1.049e-09,
    0.0,
    -1.472e-09,
    2.28e-10,
    0.0,
    0.0,
    0.029999999329,
    0.029999999329,
    0.005196152255,
    0.005196152255,
    0.008660254069,
    0.001732050674,
    -0.001732050674,
    -0.005196152255,
    -0.005196152255,
    -0.001732050674,
    -0.005196152255,
    0.001732050674,
    0.005196152255,
    -0.001732050674,
    -0.008873239238,
    -0.008873239238,
    -0.014999999665,
    -0.004014084417,
    -0.00069723839,
    0.002938752117,
    0.001722036692,
    -0.000389888119,
    0.001667250473,
    0.000782236808,
    -0.000357107418,
    -0.000299943671,
    0.000476927066,
    0.000620723269,
    0.002360050312,
    0.001478636886,
    0.002211223,
    -0.001889147722,
    0.000289280531,
    0.001765802702,
    0.000535773499,
    0.001529791672,
    0.001062780765,
    -0.00154751389,
    0.002075698208,
    -0.001448254376,
    6.2866754e-05,
    -0.00222613484
  ],
  "certificate": {
    "distance_expansion_violations": 0,
    "maximum_distance_expansion": 0.0,
    "non_expansive": true,
    "orthonormal_max_error": 1.1102230246251565e-15,
    "spectral_norm": 1.0000000000000002,
    "tolerance": 1e-05
  },
  "deterministic_replay": true,
  "deterministic_replay_sha256": "fa88d9737329c7b14da2480141c1996f0ff4b2a94da7ad42c8c124e75be7dc79",
  "explained_variance_ratio": [
    0.463394731969,
    0.287422574601,
    0.247150855504,
    0.001031205437
  ],
  "fit_node_count": 142,
  "fit_node_ids_sha256": "b38b60d7e4038489e79ecad7cbe474f5ef09c039248eea5c44387c972736faae",
  "fit_split": "train",
  "has_time_axis": false,
  "method": "train_split_centered_pca_with_orthonormal_rows",
  "metric": "euclidean_l2",
  "observer_only": true,
  "projection_id": "engineering-v0-all-spatial-shadow4-v1",
  "random_basis_placebo_seed": 20365648,
  "reach_radius": 1.25,
  "schema_version": 1,
  "source_coordinates_sha256": "212e1f7235d3255ae495f73d9ae9dc07bdeba7d40f853695d5168714f33737a0",
  "source_dimensions": 48,
  "target_dimensions": 4,
  "train_rank": 29,
  "used_for_admission": false,
  "world_id": "engineering-v0"
}
