{
  "all_spatial": true,
  "axis_names": [
    "x",
    "y",
    "z",
    "w"
  ],
  "axis_shuffle_permutation": [
    11,
    27,
    39,
    47,
    0,
    43,
    9,
    3,
    13,
    30,
    1,
    12,
    25,
    20,
    44,
    2,
    6,
    35,
    14,
    18,
    24,
    10,
    7,
    32,
    28,
    5,
    21,
    15,
    31,
    16,
    45,
    4,
    41,
    33,
    22,
    17,
    8,
    40,
    46,
    29,
    23,
    37,
    26,
    42,
    19,
    36,
    38,
    34
  ],
  "axis_shuffle_placebo_seed": 20391362,
  "basis": [
    [
      -0.007115035044,
      0.0,
      0.999600610781,
      -0.025701589878,
      -0.0,
      -0.0,
      -0.0,
      -0.0,
      -0.0,
      -0.0,
      -0.0,
      -0.0,
      -0.0,
      -0.0,
      -0.0,
      -0.0,
      -0.0,
      -0.0,
      -0.0,
      -0.0,
      -0.0,
      -0.0,
      -0.0,
      -0.0,
      -0.00128083481,
      -0.001525104282,
      -0.00087163504,
      -0.002514108057,
      -0.002386607003,
      0.002453087706,
      -0.001560921936,
      -0.001174758844,
      -0.001826939279,
      0.002132832763,
      0.001737865437,
      0.002572304716,
      0.002358841796,
      0.001125734259,
      0.002873820728,
      0.002635606197,
      -0.001906676014,
      -0.000768040111,
      0.001515783707,
      -6.8668375e-05,
      0.002189678529,
      0.002076164681,
      -0.001446197674,
      -0.001887300305
    ],
    [
      0.013563154003,
      -0.0,
      0.025786542414,
      0.999538581494,
      0.0,
      0.0,
      0.0,
      0.0,
      0.0,
      0.0,
      0.0,
      0.0,
      0.0,
      0.0,
      0.0,
      0.0,
      0.0,
      0.0,
      0.0,
      0.0,
      0.0,
      0.0,
      0.0,
      0.0,
      -0.001049963029,
      -0.00073484504,
      0.000241119998,
      -0.001358907199,
      -0.001705954223,
      -0.003479310291,
      -0.00085983534,
      0.000700475465,
      -0.001392581117,
      0.001347409657,
      0.001647990455,
      -0.002177822329,
      0.002345387264,
      -0.000725294937,
      -0.000624950331,
      0.001706013337,
      0.000802368572,
      -0.000492685577,
      2.2749392e-05,
      -0.000514999096,
      -0.002291931194,
      0.003462363189,
      -0.002166766686,
      0.003208825447
    ],
    [
      0.999805103385,
      0.0,
      0.006751629325,
      -0.013698864464,
      0.0,
      0.0,
      0.0,
      0.0,
      0.0,
      0.0,
      0.0,
      0.0,
      0.0,
      0.0,
      0.0,
      0.0,
      0.0,
      0.0,
      0.0,
      0.0,
      0.0,
      0.0,
      0.0,
      0.0,
      0.000654663013,
      0.001885878836,
      -0.001457745984,
      -0.000133141044,
      0.002298941216,
      0.004691342003,
      0.001535409846,
      0.00155531465,
      -0.004565089318,
      -0.001165173256,
      0.002523815451,
      -0.000624380993,
      -0.002243346077,
      0.000645715999,
      0.004535818631,
      -0.003314459912,
      -0.002128575918,
      0.003076813076,
      0.002280969199,
      -0.004195440641,
      -0.001090053867,
      -0.002230405888,
      -0.000271882418,
      -0.003051010038
    ],
    [
      -3.0370584e-05,
      0.0,
      -0.000315816252,
      0.000271558482,
      0.0,
      0.0,
      -0.0,
      0.0,
      -0.0,
      -0.0,
      0.0,
      -0.0,
      0.0,
      0.0,
      0.0,
      -0.0,
      -0.0,
      -0.0,
      -0.0,
      -0.0,
      -0.0,
      -0.0,
      -0.0,
      0.0,
      0.409813671761,
      -0.258825193573,
      0.250654284548,
      -0.12610284212,
      -0.246340671917,
      0.169237874897,
      -0.210504357663,
      0.181084051706,
      -0.036049037298,
      -0.311410108798,
      -0.043279447021,
      -0.095833155942,
      -0.202757269652,
      -0.175340693462,
      0.127145878344,
      -0.148924747127,
      -0.107288020715,
      -0.399220389128,
      0.168943799701,
      0.026653150971,
      0.022569440975,
      0.221998611486,
      0.217897159567,
      0.054401377634
    ]
  ],
  "basis_sha256": "ff0c77fa772dea5c00c639fc6b29bc7bc8dadc007cf46ad5a662c9d444741fbd",
  "cell_quantization": {
    "cell_width": 0.25,
    "method": "nearest_integer_cell"
  },
  "center": [
    1.31e-10,
    0.0,
    2.26e-10,
    -5.23e-10,
    0.0,
    0.0,
    0.029999999329,
    0.029999999329,
    0.004330127034,
    0.0,
    0.008660254069,
    0.0,
    0.004330127034,
    -0.004330127034,
    -0.004330127034,
    0.004330127034,
    0.0,
    -0.004330127034,
    0.004330127034,
    0.0,
    -0.014999999665,
    -0.014999999665,
    0.014999999665,
    -0.014999999665,
    -0.000189489883,
    -0.000236838817,
    -0.000158974516,
    -0.000166447435,
    -0.000294563228,
    0.000253008894,
    -0.000187260453,
    -0.000279496644,
    -0.000188887761,
    0.000219258288,
    0.000328199769,
    0.000341731969,
    0.000271748674,
    0.000166753748,
    0.000281199966,
    0.00030380971,
    -0.000268773835,
    -7.9173207e-05,
    0.000193133289,
    6.0763334e-05,
    0.00018263314,
    0.000189190583,
    -0.000221031125,
    -0.000291160873
  ],
  "certificate": {
    "distance_expansion_violations": 0,
    "maximum_distance_expansion": 0.0,
    "non_expansive": true,
    "orthonormal_max_error": 6.661338147750939e-16,
    "spectral_norm": 1.0000000000000004,
    "tolerance": 1e-05
  },
  "deterministic_replay": true,
  "deterministic_replay_sha256": "36c7b3be8dabc8175b53dbbfcc41908bef3a45d1f8e2314f8d157067dc16d52a",
  "explained_variance_ratio": [
    0.518871870016,
    0.458938966596,
    0.020982288087,
    7.6068734e-05
  ],
  "fit_node_count": 461,
  "fit_node_ids_sha256": "93872e3fd58a9533a12760df2996b8688435f3eee0a0ec4db3f197df63d97f5f",
  "fit_split": "train",
  "has_time_axis": false,
  "method": "train_split_centered_pca_with_orthonormal_rows",
  "metric": "euclidean_l2",
  "observer_only": true,
  "projection_id": "taxonomy-mesh2026-computer-science-0001-v0-all-spatial-shadow4-v1",
  "random_basis_placebo_seed": 20365728,
  "reach_radius": 1.25,
  "schema_version": 1,
  "source_coordinates_sha256": "0c948ccd09f865fe95534b2953c3edaa57cff3fe1b604a91a0313f8d6aaa50f4",
  "source_dimensions": 48,
  "target_dimensions": 4,
  "train_rank": 27,
  "used_for_admission": false,
  "world_id": "taxonomy-mesh2026-computer-science-0001-v0"
}
