{
  "all_spatial": true,
  "axis_names": [
    "x",
    "y",
    "z",
    "w"
  ],
  "axis_shuffle_permutation": [
    30,
    15,
    10,
    28,
    0,
    36,
    16,
    25,
    34,
    5,
    39,
    3,
    21,
    13,
    14,
    6,
    12,
    11,
    40,
    24,
    4,
    22,
    47,
    33,
    2,
    17,
    44,
    9,
    18,
    19,
    37,
    32,
    7,
    31,
    27,
    26,
    43,
    45,
    1,
    8,
    38,
    29,
    46,
    42,
    41,
    35,
    23,
    20
  ],
  "axis_shuffle_placebo_seed": 20391289,
  "basis": [
    [
      0.004766025034,
      -0.0,
      -0.491784645062,
      0.8706710929,
      0.0,
      0.0,
      0.0,
      0.0,
      0.0,
      0.0,
      0.0,
      0.0,
      0.0,
      0.0,
      0.0,
      0.0,
      0.0,
      0.0,
      0.0,
      0.0,
      0.0,
      0.0,
      0.0,
      0.0,
      -0.001142196719,
      -0.001902849977,
      0.001223481831,
      -0.000383949529,
      -0.001263576835,
      -0.002035934761,
      -0.000466478426,
      0.001792776358,
      0.000611694536,
      -0.001587626398,
      0.001501019926,
      -0.001905717879,
      -0.000344726028,
      -0.000676468166,
      0.001357988593,
      0.000700888505,
      -0.002396433252,
      0.002243351978,
      -0.002573929898,
      0.002101663661,
      0.001473531756,
      0.001878369552,
      -0.000922434243,
      -0.001092402058
    ],
    [
      0.000181660518,
      -0.0,
      0.87069388906,
      0.491797488712,
      -0.0,
      -0.0,
      -0.0,
      -0.0,
      0.0,
      0.0,
      0.0,
      0.0,
      0.0,
      0.0,
      0.0,
      -0.0,
      -0.0,
      -0.0,
      -0.0,
      -0.0,
      -0.0,
      -0.0,
      -0.0,
      -0.0,
      0.001466837288,
      -0.000302166701,
      0.00052153795,
      -0.000401681084,
      0.001848485668,
      0.000163544927,
      -0.000553479728,
      0.000521279099,
      0.001666323014,
      -0.000193873622,
      -0.000874026463,
      -0.000485605937,
      0.001264657502,
      0.002927826546,
      -0.001779506356,
      -0.000898909912,
      6.9445361e-05,
      1.6085475e-05,
      -0.001495755687,
      6.3847788e-05,
      0.000158492133,
      0.000551301113,
      -0.000337639233,
      -3.1733809e-05
    ],
    [
      0.999921051735,
      -0.0,
      0.002181676759,
      -0.004224721028,
      -0.0,
      -0.0,
      -0.0,
      -0.0,
      0.0,
      0.0,
      0.0,
      0.0,
      0.0,
      0.0,
      0.0,
      -0.0,
      -0.0,
      -0.0,
      -0.0,
      -0.0,
      -0.0,
      -0.0,
      -0.0,
      -0.0,
      0.003230604195,
      5.6729742e-05,
      -0.000172431617,
      0.000421406812,
      -0.001119997069,
      -0.004115823386,
      0.000258667776,
      -0.001419124756,
      -0.00096852662,
      0.002138709827,
      0.003287709879,
      0.005324113061,
      -0.002651887292,
      0.003096677421,
      0.002928254317,
      -0.002577947061,
      0.002199275059,
      -0.000953664264,
      -0.00125767546,
      -9.5021469e-05,
      -0.002506193852,
      -0.001734555472,
      0.001293091327,
      -0.003090498045
    ],
    [
      0.004566645799,
      -0.0,
      5.5165222e-05,
      0.000186536406,
      0.0,
      0.0,
      0.0,
      0.0,
      -0.0,
      0.0,
      0.0,
      0.0,
      0.0,
      0.0,
      -0.0,
      0.0,
      -0.0,
      -0.0,
      0.0,
      0.0,
      0.0,
      0.0,
      0.0,
      0.0,
      -0.163029448227,
      -0.233613888983,
      0.060052562222,
      -0.050773896087,
      0.016165231167,
      0.198940395905,
      -0.179924675663,
      0.088653310963,
      -0.005593599046,
      0.308207191063,
      -0.151913653666,
      -0.038985553274,
      0.17461074806,
      -0.138126041524,
      -0.204205068272,
      0.55664438169,
      0.037941602349,
      0.128643710212,
      0.114244629958,
      -0.195914266501,
      -0.327395619289,
      0.291788620291,
      -0.220574343898,
      -0.037740451593
    ]
  ],
  "basis_sha256": "ecf5875c5d65d0e20651fa1121f774b58ed91096d36c03f96ca40080a8f49912",
  "cell_quantization": {
    "cell_width": 0.25,
    "method": "nearest_integer_cell"
  },
  "center": [
    -4e-12,
    0.0,
    -3.26e-10,
    -6.91e-10,
    0.0,
    0.0,
    0.029999999329,
    0.029999999329,
    0.0,
    0.004330127034,
    0.004330127034,
    0.008660254069,
    0.0,
    -0.004330127034,
    0.0,
    -0.004330127034,
    0.0,
    0.0,
    0.0,
    -0.008660254069,
    0.014999999665,
    0.014999999665,
    -0.014999999665,
    -0.014999999665,
    0.000135031081,
    0.000191898306,
    -8.1503039e-05,
    -3.2036975e-05,
    7.1370989e-05,
    0.000114581082,
    6.9018468e-05,
    -0.000192103162,
    -0.000108563288,
    0.00020608733,
    -0.000129046614,
    0.000251231242,
    3.908691e-05,
    6.3308314e-05,
    -6.188136e-05,
    -5.1780934e-05,
    0.000138295773,
    -0.000201198629,
    0.00029080295,
    -0.000159893425,
    -0.000178185323,
    -0.000201209601,
    3.211636e-05,
    0.000113201822
  ],
  "certificate": {
    "distance_expansion_violations": 0,
    "maximum_distance_expansion": 0.0,
    "non_expansive": true,
    "orthonormal_max_error": 1.2212453270876722e-15,
    "spectral_norm": 1.0000000000000004,
    "tolerance": 1e-05
  },
  "deterministic_replay": true,
  "deterministic_replay_sha256": "ddb47761d5a94d76d9c101a9ee70284c46c18580e83c01ae9d5c3160dda804a9",
  "explained_variance_ratio": [
    0.492022820605,
    0.491997409312,
    0.014796170241,
    6.3563915e-05
  ],
  "fit_node_count": 623,
  "fit_node_ids_sha256": "f999ff11629b084a540f7228029fb57e45df98068158757b610f60ae37a6c003",
  "fit_split": "train",
  "has_time_axis": false,
  "method": "train_split_centered_pca_with_orthonormal_rows",
  "metric": "euclidean_l2",
  "observer_only": true,
  "projection_id": "taxonomy-mesh2026-biology-0001-v0-all-spatial-shadow4-v1",
  "random_basis_placebo_seed": 20365655,
  "reach_radius": 1.25,
  "schema_version": 1,
  "source_coordinates_sha256": "4139d4738c432667ef466fb4db22645d0e2de070314df17955ed9db5c83b92e3",
  "source_dimensions": 48,
  "target_dimensions": 4,
  "train_rank": 27,
  "used_for_admission": false,
  "world_id": "taxonomy-mesh2026-biology-0001-v0"
}
