{
  "all_spatial": true,
  "axis_names": [
    "x",
    "y",
    "z",
    "w"
  ],
  "axis_shuffle_permutation": [
    28,
    44,
    10,
    5,
    26,
    32,
    16,
    37,
    22,
    12,
    23,
    24,
    0,
    25,
    4,
    40,
    9,
    1,
    45,
    7,
    31,
    2,
    3,
    39,
    11,
    30,
    21,
    13,
    33,
    29,
    15,
    34,
    14,
    20,
    17,
    36,
    6,
    41,
    27,
    47,
    8,
    38,
    18,
    46,
    42,
    35,
    43,
    19
  ],
  "axis_shuffle_placebo_seed": 20391307,
  "basis": [
    [
      0.004353590132,
      0.0,
      -0.281019105377,
      0.959654660695,
      0.0,
      0.0,
      0.0,
      0.0,
      0.0,
      0.0,
      0.0,
      0.0,
      0.0,
      0.0,
      0.0,
      0.0,
      0.0,
      0.0,
      0.0,
      0.0,
      0.0,
      0.0,
      0.0,
      0.0,
      -0.002132942447,
      0.002473335886,
      -0.00205939841,
      0.000678587943,
      -0.001905946679,
      0.001931355792,
      0.002702762437,
      -0.0025866344,
      -0.000456468062,
      -0.001412833403,
      0.001669905491,
      0.001996144771,
      -0.001537741694,
      0.001484854255,
      -0.001308228376,
      0.001216928973,
      -0.000165619372,
      -0.001496122069,
      -0.001872590939,
      0.002212472639,
      -9.3662451e-05,
      -0.00141117023,
      -0.001984250991,
      -0.001473002708
    ],
    [
      -0.001073396922,
      0.0,
      0.959684604216,
      0.281028017835,
      -0.0,
      -0.0,
      -0.0,
      -0.0,
      -0.0,
      -0.0,
      -0.0,
      -0.0,
      -0.0,
      -0.0,
      -0.0,
      -0.0,
      -0.0,
      -0.0,
      -0.0,
      -0.0,
      -0.0,
      -0.0,
      -0.0,
      -0.0,
      -0.00016901515,
      -3.4472191e-05,
      0.001618185385,
      -0.001776897655,
      -0.00045948224,
      -0.000695410322,
      0.001319273307,
      -0.000508969066,
      0.001221025454,
      -0.002203466957,
      -0.000908053258,
      0.000839725302,
      -1.202954e-06,
      -8.7142793e-05,
      0.00115565524,
      0.002100145069,
      -0.000135788705,
      -0.001053519954,
      -3.0820102e-05,
      9.20409e-05,
      0.001854707503,
      -8.340238e-06,
      -0.000193639921,
      0.000903695032
    ],
    [
      0.999924138404,
      -0.0,
      0.002253438236,
      -0.003885035438,
      0.0,
      0.0,
      0.0,
      0.0,
      0.0,
      0.0,
      0.0,
      0.0,
      0.0,
      0.0,
      0.0,
      0.0,
      0.0,
      0.0,
      0.0,
      0.0,
      0.0,
      0.0,
      0.0,
      0.0,
      -0.00036257698,
      0.002379901788,
      -0.002897540029,
      0.001610936535,
      0.002325019513,
      -0.00397648962,
      0.000737435017,
      0.000742598008,
      0.003628520939,
      0.000870856245,
      -0.003566329177,
      0.001663064309,
      -0.002360441696,
      0.00181337965,
      -0.004818515926,
      -0.001205972956,
      -0.000324436372,
      -0.003387865498,
      -0.000552474444,
      -0.001369039544,
      0.002483212783,
      -0.002287838238,
      0.001678794546,
      0.001234272344
    ],
    [
      0.000803182389,
      0.0,
      8.4798473e-05,
      0.000177895099,
      -0.0,
      -0.0,
      -0.0,
      -0.0,
      0.0,
      -0.0,
      0.0,
      0.0,
      -0.0,
      -0.0,
      -0.0,
      -0.0,
      0.0,
      0.0,
      0.0,
      0.0,
      -0.0,
      -0.0,
      -0.0,
      -0.0,
      0.101341363317,
      -0.076359368969,
      -0.025332295289,
      0.068830050098,
      -0.006224195698,
      -0.003623125626,
      -0.138136141366,
      -0.3236292246,
      -0.041300236645,
      -0.105991754427,
      -0.094782916809,
      -0.092502329079,
      -0.021858447754,
      -0.072815128715,
      -0.020614042821,
      -0.073500171198,
      0.810220008802,
      -0.126766917114,
      -0.167545498406,
      -0.05107265785,
      -0.081781896704,
      0.23679012817,
      -0.149923185815,
      0.155310437173
    ]
  ],
  "basis_sha256": "466dd6baee2a33834ae8efa4a40c143f8fdf9395165e246413ac0f2534f38f80",
  "cell_quantization": {
    "cell_width": 0.25,
    "method": "nearest_integer_cell"
  },
  "center": [
    1.5e-11,
    0.0,
    3.91e-10,
    4.2e-11,
    0.0,
    0.0,
    0.029999999329,
    0.029999999329,
    0.0,
    0.004330127034,
    0.004330127034,
    0.008660254069,
    0.0,
    -0.004330127034,
    0.0,
    -0.004330127034,
    0.0,
    0.0,
    0.0,
    -0.008660254069,
    0.014999999665,
    0.014999999665,
    -0.014999999665,
    -0.014999999665,
    0.000214171501,
    -0.00016862445,
    0.000196071393,
    -0.000264103972,
    0.000171694224,
    -0.000118281153,
    -0.000335742164,
    0.000295365771,
    0.00020681982,
    0.000184083608,
    -0.000124427723,
    -0.000401708578,
    0.00010643297,
    -1.7009067e-05,
    6.408711e-05,
    -0.000365527279,
    4.1685337e-05,
    0.000101937679,
    7.5698185e-05,
    -0.000271252575,
    6.8087125e-05,
    0.000108936059,
    0.000229430957,
    0.000107768635
  ],
  "certificate": {
    "distance_expansion_violations": 0,
    "maximum_distance_expansion": 0.0,
    "non_expansive": true,
    "orthonormal_max_error": 7.771561172376096e-16,
    "spectral_norm": 1.0000000000000004,
    "tolerance": 1e-05
  },
  "deterministic_replay": true,
  "deterministic_replay_sha256": "b59028a032024cb82bf3c6106e774044302795efe6c7adc557c281810aca72f8",
  "explained_variance_ratio": [
    0.492076211042,
    0.492045726849,
    0.014704490983,
    8.4956627e-05
  ],
  "fit_node_count": 627,
  "fit_node_ids_sha256": "8467833b04e8d76f7c4c6fc1d84c395adc0a8d6d5a8f403e02654b510444ca3e",
  "fit_split": "train",
  "has_time_axis": false,
  "method": "train_split_centered_pca_with_orthonormal_rows",
  "metric": "euclidean_l2",
  "observer_only": true,
  "projection_id": "taxonomy-mesh2026-biology-0019-v0-all-spatial-shadow4-v1",
  "random_basis_placebo_seed": 20365673,
  "reach_radius": 1.25,
  "schema_version": 1,
  "source_coordinates_sha256": "b69eab1d98ef9b7a311f15b451c8b2ebab13a85ecdb95a90ad8e7b17b6f0dc48",
  "source_dimensions": 48,
  "target_dimensions": 4,
  "train_rank": 27,
  "used_for_admission": false,
  "world_id": "taxonomy-mesh2026-biology-0019-v0"
}
